[
	{
		"key": "medtronic.guardian_4",
		"categoryKey": "cgm_sensor",
		"manufacturer": "Medtronic",
		"name": "Guardian 4",
		"gtin": "00763000413385",
		"containsProductKey": null,
		"containsQty": 1,
		"ratedWearDays": 7,
		"minSamples": 3,
		"expiryRule": "finish_by",
		"expiryStrictness": "soft",
		"sourceUrl": "https://www.diabetes.shop/sensors/g4s/guardian-4-sensor",
		"verified": true
	},
	{
		"key": "medtronic.guardian_4_5",
		"categoryKey": "cgm_sensor",
		"manufacturer": "Medtronic",
		"name": "Guardian 4 - 5 Pack",
		"gtin": "20763000413389",
		"containsProductKey": "medtronic.guardian_4",
		"containsQty": 5,
		"ratedWearDays": 7,
		"minSamples": 3,
		"expiryRule": "finish_by",
		"expiryStrictness": "soft",
		"sourceUrl": "https://www.diabetes.shop/sensors/g4s/guardian-4-sensor",
		"verified": true
	},
	{
		"key": "medtronic.instinct",
		"categoryKey": "cgm_sensor",
		"manufacturer": "Medtronic",
		"name": "Instinct sensor",
		"gtin": "00357599880002",
		"containsProductKey": null,
		"containsQty": 1,
		"ratedWearDays": 10,
		"minSamples": 3,
		"expiryRule": "finish_by",
		"expiryStrictness": "hard",
		"sourceUrl": "https://www.diabetes.shop/sensors/instinct_sensor/78893-01",
		"verified": true
	},
	{
		"key": "medtronic.extended_infusion_set_6_23",
		"categoryKey": "infusion_set",
		"manufacturer": "Medtronic",
		"name": "Extended Infusion Set (6mm, 23\")",
		"gtin": "05705244023420",
		"containsProductKey": null,
		"containsQty": 1,
		"ratedWearDays": 7,
		"minSamples": 3,
		"expiryRule": "finish_by",
		"expiryStrictness": "soft",
		"sourceUrl": "https://www.diabetes.shop/infusion-sets/extended-infusion-set/extended-infusion-set-6-23-5",
		"verified": true
	},
	{
		"key": "medtronic.extended_infusion_set_6_23_5",
		"categoryKey": "infusion_set",
		"manufacturer": "Medtronic",
		"name": "Extended Infusion Set (6mm, 23\") - 5 Pack",
		"gtin": "05705244023406",
		"containsProductKey": "medtronic.extended_infusion_set_6_23",
		"containsQty": 5,
		"ratedWearDays": 7,
		"minSamples": 3,
		"expiryRule": "finish_by",
		"expiryStrictness": "soft",
		"sourceUrl": "https://www.diabetes.shop/infusion-sets/extended-infusion-set/extended-infusion-set-6-23-5",
		"verified": true
	},
	{
		"key": "medtronic.extended_reservoir",
		"categoryKey": "cartridge",
		"manufacturer": "Medtronic",
		"name": "Extended Reservoir",
		"gtin": "00763000496999",
		"containsProductKey": null,
		"containsQty": 1,
		"ratedWearDays": 7,
		"minSamples": 3,
		"expiryRule": "finish_by",
		"expiryStrictness": "soft",
		"sourceUrl": "https://www.diabetes.shop/reservoirs/extended-reservoir/extended-reservoir",
		"verified": true
	},
	{
		"key": "medtronic.extended_reservoir_10",
		"categoryKey": "cartridge",
		"manufacturer": "Medtronic",
		"name": "Extended Reservoir - 10 Pack",
		"gtin": "20763000497181",
		"containsProductKey": "medtronic.extended_reservoir",
		"containsQty": 10,
		"ratedWearDays": 7,
		"minSamples": 3,
		"expiryRule": "finish_by",
		"expiryStrictness": "soft",
		"sourceUrl": "https://www.diabetes.shop/reservoirs/extended-reservoir/extended-reservoir",
		"verified": true
	}
]